{
  "$schema": "http://json-schema.org/draft-07/schema#",
  "$comment": "GENERATED by gui/schema-gen/derive_nf_config_schemas.py from config/sepp.json + its source (ADR-0425). Do not edit; regenerate.",
  "title": "sepp",
  "type": "object",
  "additionalProperties": false,
  "properties": {
    "port": {
      "type": "integer",
      "x-env-override": "SEPP_PORT",
      "x-cpp-type": "unsigned short"
    },
    "n32_port": {
      "type": "integer",
      "x-env-override": "SEPP_N32_PORT",
      "x-cpp-type": "unsigned short"
    },
    "sbi_bind_address": {
      "type": "string",
      "x-cpp-type": "std::string"
    },
    "advertised_ipv4": {
      "type": "string",
      "x-env-override": "SEPP_ADVERTISED_IPV4",
      "x-cpp-type": "std::string"
    },
    "metrics_bind_address": {
      "type": "string",
      "x-env-override": "SEPP_METRICS_BIND_ADDRESS",
      "x-cpp-type": "std::string"
    },
    "nrf_base_url": {
      "type": "string",
      "x-env-override": "SEPP_NRF_BASE_URL",
      "x-cpp-type": "std::string"
    },
    "fqdn": {
      "type": "string",
      "x-env-override": "SEPP_FQDN",
      "x-cpp-type": "std::string"
    },
    "cert_path": {
      "type": "string"
    },
    "key_path": {
      "type": "string"
    },
    "trust_anchors": {
      "type": "array",
      "items": {
        "type": "object",
        "additionalProperties": false,
        "properties": {
          "roots": {
            "type": "array",
            "items": {
              "type": "string"
            }
          },
          "plmns": {
            "type": "array",
            "items": {
              "type": "object",
              "additionalProperties": false,
              "properties": {
                "mcc": {
                  "type": "string"
                },
                "mnc": {
                  "type": "string"
                }
              }
            }
          }
        }
      },
      "x-cpp-type": "nlohmann::json"
    },
    "mcc": {
      "type": "string",
      "x-env-override": "SEPP_MCC",
      "x-cpp-type": "std::string"
    },
    "mnc": {
      "type": "string",
      "x-env-override": "SEPP_MNC",
      "x-cpp-type": "std::string"
    },
    "allowed_purposes": {
      "type": "array",
      "items": {
        "type": "string"
      }
    },
    "security_capabilities": {
      "type": "array",
      "items": {
        "type": "string"
      }
    },
    "protection_policy": {
      "type": "object",
      "additionalProperties": false,
      "properties": {
        "apiIeMappingList": {
          "type": "array",
          "items": {
            "type": "object",
            "additionalProperties": false,
            "properties": {
              "apiSignature": {
                "type": "string"
              },
              "apiMethod": {
                "type": "string"
              },
              "IeList": {
                "type": "array",
                "items": {
                  "type": "object",
                  "additionalProperties": false,
                  "properties": {
                    "ieLoc": {
                      "type": "string"
                    },
                    "ieType": {
                      "type": "string"
                    },
                    "reqIe": {
                      "type": "string"
                    },
                    "rspIe": {
                      "type": "string"
                    }
                  }
                }
              }
            }
          }
        },
        "dataTypeEncPolicy": {
          "type": "array",
          "items": {
            "type": "string"
          }
        }
      }
    },
    "handshake_retry_seconds": {
      "type": "integer"
    },
    "telescopic_table_max": {
      "type": "integer"
    },
    "peers": {
      "type": "array",
      "items": {
        "type": "object",
        "additionalProperties": false,
        "properties": {
          "fqdn": {
            "type": "string"
          },
          "mcc": {
            "type": "string"
          },
          "mnc": {
            "type": "string"
          },
          "n32_api_root": {
            "type": "string"
          },
          "initiate": {
            "type": "boolean"
          }
        }
      }
    },
    "local_nf_routes": {
      "type": "object",
      "additionalProperties": false,
      "properties": {
        "nrf.5gc.mnc001.mcc001.3gppnetwork.org:7777": {
          "type": "string"
        }
      }
    }
  },
  "required": [
    "advertised_ipv4",
    "fqdn",
    "mcc",
    "metrics_bind_address",
    "mnc",
    "n32_port",
    "nrf_base_url",
    "port",
    "sbi_bind_address",
    "trust_anchors"
  ],
  "x-config-file": "config/sepp.json",
  "x-source": [
    "nfs/sepp"
  ],
  "x-apply": "restart",
  "x-review": [
    "trust_anchors[]: nested object shape inferred from current values (map-vs-struct meaning unverified; new keys refused until reviewed)",
    "trust_anchors[].plmns[]: nested object shape inferred from current values (map-vs-struct meaning unverified; new keys refused until reviewed)",
    "protection_policy: nested object shape inferred from current values (map-vs-struct meaning unverified; new keys refused until reviewed)",
    "protection_policy.apiIeMappingList[]: nested object shape inferred from current values (map-vs-struct meaning unverified; new keys refused until reviewed)",
    "protection_policy.apiIeMappingList[].IeList[]: nested object shape inferred from current values (map-vs-struct meaning unverified; new keys refused until reviewed)",
    "peers[]: nested object shape inferred from current values (map-vs-struct meaning unverified; new keys refused until reviewed)",
    "local_nf_routes: nested object shape inferred from current values (map-vs-struct meaning unverified; new keys refused until reviewed)"
  ]
}
